AvgDialog_19073_Content_15,agTL,avg章4_AvgDialog_C_M.csv,492,AvgDialog,Content,朵尔,作为追求最尖端科技的研究者，谁不想舍弃掉那些本就不该束缚我们的人类伦理，进行最胆大妄为的实验呢？,"As researchers pursuing the most cutting-edge technology, who wouldn't want to discard those human ethics that should never have bound us in the first place and carry out the boldest experiments?"
AvgDialog_19073_Content_16,agTM,avg章4_AvgDialog_C_M.csv,493,AvgDialog,Content,朵尔,可惜……,Unfortunately...
AvgDialog_19073_Content_17,agTN,avg章4_AvgDialog_C_M.csv,494,AvgDialog,Content,朵尔,跟你这种只懂得趋利避害的草履虫比起来，我还是更欣赏这帮家伙明知不可为而为的勇气。,"Compared to a paramecium like you, who only knows how to seek profit and avoid harm, I admire these guys for their courage to attempt the impossible."
AvgDialog_19073_Content_18,agTO,avg章4_AvgDialog_C_M.csv,495,AvgDialog,Content,朵尔,"闲话就到这里吧。
再让你拖延下去，只怕弗朗西斯就要带着莉莉跑到大洋对岸了。","Enough chit-chat.\nIf you keep stalling, Francis might take Lily across the ocean."
AvgDialog_19073_Content_19,agTP,avg章4_AvgDialog_C_M.csv,496,AvgDialog,Content,赫伯特,真不愧是“弥萨格之脑”，什么都瞒不过你。,"As expected of the ""Brain of Mythag"", nothing escapes you."
AvgDialog_19073_Content_20,agTR,avg章4_AvgDialog_C_M.csv,497,AvgDialog,Content,,赫伯特拍了拍手，身后的十数扇房门应声而开。,"Herbert clapped his hands, and a dozen doors behind him opened immediately."
AvgDialog_19073_Content_21,agTS,avg章4_AvgDialog_C_M.csv,498,AvgDialog,Content,,刺骨的杀意在黑暗中蔓延，阴暗狭窄的走廊上回荡着黏着怪异的嘶吼声。,"A bone-chilling killing intent spreads through the darkness, echoing with eerie hisses in the narrow, shadowy corridors."
AvgDialog_19073_Content_22,agTT,avg章4_AvgDialog_C_M.csv,499,AvgDialog,Content,朵尔,拉蒙娜，%player%！,"Ramona, %player%!"
AvgDialog_19073_Content_23,agTU,avg章4_AvgDialog_C_M.csv,500,AvgDialog,Content,玩家,我们在！,We're here!
AvgDialog_19073_Content_24,agTV,avg章4_AvgDialog_C_M.csv,501,AvgDialog,Content,朵尔,这位老朋友就交给我，你们去拦住弗朗西斯。,Leave this old friend to me. You go and stop Francis.
AvgDialog_19073_Content_25,agTW,avg章4_AvgDialog_C_M.csv,502,AvgDialog,Content,朵尔,刚才给你们的镜片，戴上后就能看见通往其他维度的“<Yellow:通道>”。,"With the monocle I just gave you, you should be able to see the ""<Yellow:passage>"" to other dimensions."
AvgDialog_19073_Content_26,agTX,avg章4_AvgDialog_C_M.csv,503,AvgDialog,Content,朵尔,没有特殊情况，千万不要摘下来。头晕是正常现象，实在忍不了，就喝一管药剂。,"Unless absolutely necessary, do not take it off. Dizziness is normal; if you can't bear it, drink the elixir I gave you."
AvgDialog_19073_Content_27,agTY,avg章4_AvgDialog_C_M.csv,504,AvgDialog,Content,玩家,可你一个人——,But you—
AvgDialog_19073_Content_28,agTZ,avg章4_AvgDialog_C_M.csv,505,AvgDialog,Content,朵尔,走！,Go!
AvgDialog_19073_Content_29,agUa,avg章4_AvgDialog_C_M.csv,506,AvgDialog,Content,朵尔,弥萨格大学和雕塑家协会斗了这么多年，他要是有本事搞定我们，根本就等不到现在。,"Mythag University and the Sculptors' Association have been fighting for many years. If he had the ability to defeat us, he wouldn't have waited until now."
AvgDialog_19073_Content_30,agUc,avg章4_AvgDialog_C_M.csv,507,AvgDialog,Content,朵尔,愿银钥指引前路。,May the Silver Key guide you.
AvgDialog_19073_Content_31,agUd,avg章4_AvgDialog_C_M.csv,508,AvgDialog,Content,玩家,……,…
AvgDialog_19073_Content_32,agUe,avg章4_AvgDialog_C_M.csv,509,AvgDialog,Content,玩家,愿银钥指引我们。,May the Silver Key guide us.
AvgDialog_19073_Content_33,agUf,avg章4_AvgDialog_C_M.csv,510,AvgDialog,Content,,你戴上金属单片镜，和拉蒙娜转身朝着走廊的最东侧突围。,"You put on the monocle and, together with Ramona, turn to break through toward the eastern end of the corridor."
AvgDialog_19073_Content_34,agUg,avg章4_AvgDialog_C_M.csv,511,AvgDialog,Content,,在余光中，赫伯特唤出的十来只实验体已将朵尔牢牢包围，各个垂涎欲滴，蠢蠢欲动。,"In the corner of your eye, the ten or so experimental subjects summoned by Herbert had completely surrounded Doll, each drooling and waiting to pounce."
AvgDialog_19073_Content_35,agUh,avg章4_AvgDialog_C_M.csv,512,AvgDialog,Content,拉蒙娜,别看了！朵尔说她能搞定的。,Don't look! Doll said she could handle it.
AvgDialog_19073_Content_36,agUi,avg章4_AvgDialog_C_M.csv,513,AvgDialog,Content,拉蒙娜,相信她，并专注在我们的任务上！,Believe in her and focus on our mission!
AvgDialog_19079_Content_1,agXG,avg章4_AvgDialog_C_M.csv,514,AvgDialog,Content,,21克,21 Grams
AvgDialog_19079_Content_2,agXR,avg章4_AvgDialog_C_M.csv,515,AvgDialog,Content,朵尔,现在就是我们的时间了。,Now is our time.
AvgDialog_19079_Content_3,agYc,avg章4_AvgDialog_C_M.csv,516,AvgDialog,Content,朵尔,赫伯特，你还没放弃你那荒谬的追求吗？,"Herbert, haven't you given up on your absurd pursuit yet?"
AvgDialog_19079_Content_4,agYi,avg章4_AvgDialog_C_M.csv,517,AvgDialog,Content,赫伯特,如果你具备区分荒谬和伟大的能力，或许就会修改你的措辞。,"If you possess the ability to discern between absurdity and greatness, perhaps you would alter your wording."
AvgDialog_19079_Content_5,agYj,avg章4_AvgDialog_C_M.csv,518,AvgDialog,Content,朵尔,一切生命形态都无法逃脱融蚀，你所钻研之物只会留下满地狼藉。,No life form can escape Dissolution; your research only leaves behind chaos.
AvgDialog_19079_Content_6,agYk,avg章4_AvgDialog_C_M.csv,519,AvgDialog,Content,,朵尔不满地扫了一眼那些被称为“狼藉”的扭曲生体。,"Doll glanced disapprovingly at the twisted creatures labeled ""chaos."""
AvgDialog_19079_Content_7,agYl,avg章4_AvgDialog_C_M.csv,520,AvgDialog,Content,朵尔,你的审美还是那么不堪入目，我不记得弥萨格给你带来过这样的熏陶。,Your taste is still as terrible as ever. I don't remember Mythag ever having such an influence on you.
AvgDialog_19079_Content_8,agYm,avg章4_AvgDialog_C_M.csv,521,AvgDialog,Content,赫伯特,看来我离开后，阿利斯泰尔做主把我留下的伟大研究都抹除了。说起来——他的身体还健康吗？,"It seems that after I left, Alistair took the initiative to erase all my great research. By the way—is his body still healthy?"
AvgDialog_19079_Content_9,agYn,avg章4_AvgDialog_C_M.csv,522,AvgDialog,Content,朵尔,你还惦记着他？他恐怕会因此感到羞愧。,Are you still thinking about him? He might feel ashamed because of it.
AvgDialog_19079_Content_10,agXH,avg章4_AvgDialog_C_M.csv,523,AvgDialog,Content,赫伯特,"别这么说，我在弥萨格“毕业生”里，难道不算学有所成的吗？
毕竟没几个人能从这所学校活着毕业。","Don't say that. Among Mythag's ""graduates,"" don't I count as someone who has achieved academic success? \nAfter all, not many survive graduation."
AvgDialog_19079_Content_11,agXI,avg章4_AvgDialog_C_M.csv,524,AvgDialog,Content,赫伯特,我还不时为他祈祷祝福，希望他能早日像常人一样站起来呢。,"I often offer prayers and blessings for him, hoping he can stand up like a normal person soon."
AvgDialog_19079_Content_12,agXJ,avg章4_AvgDialog_C_M.csv,525,AvgDialog,Content,朵尔,借你吉言，至少阿利斯泰尔比你的另一位老师活得久些。,Thanks for your kind words. At least Alistair lived longer than your other teacher.
AvgDialog_19079_Content_13,agXK,avg章4_AvgDialog_C_M.csv,526,AvgDialog,Content,赫伯特,"阿利斯泰尔老师吉人天相，肯定能见证世界的终结。
很可惜，你应该看不到那一天了。","Professor Alistair is surely destined to witness the end of the world.\nUnfortunately, you will not live to see that day."
AvgDialog_19079_Content_14,agXL,avg章4_AvgDialog_C_M.csv,527,AvgDialog,Content,赫伯特,在这些家伙的包围下，你又能支撑多久呢？,How long can you hold out while surrounded by these guys?
AvgDialog_19079_Content_15,agXM,avg章4_AvgDialog_C_M.csv,528,AvgDialog,Content,朵尔,不试试怎么知道？,You'll never know until you try.
AvgDialog_19079_Content_16,agXN,avg章4_AvgDialog_C_M.csv,529,AvgDialog,Content,赫伯特,你不会真觉得，凭你一个，就能解决这么多实验体吧？,Do you really think you can handle all these test subjects on your own?
AvgDialog_19079_Content_17,agXO,avg章4_AvgDialog_C_M.csv,530,AvgDialog,Content,朵尔,不要把我想得和你一样愚蠢，赫伯特。,"Don't assume I'm as foolish as you, Herbert."
AvgDialog_19079_Content_18,agXP,avg章4_AvgDialog_C_M.csv,531,AvgDialog,Content,赫伯特,你的发声器官还是如此惹人生厌，朵尔。,"Your voice is still as grating as ever, Doll."
AvgDialog_19079_Content_19,agXQ,avg章4_AvgDialog_C_M.csv,532,AvgDialog,Content,朵尔,它至少比你那原始人的头脑更有价值。,It's at least more valuable than your primitive brain.
AvgDialog_19079_Content_20,agXS,avg章4_AvgDialog_C_M.csv,533,AvgDialog,Content,赫伯特,"只怕你的同僚们都未必认同你的结论。
要是有个按钮能把你的嘴封上，他们大概毫不犹豫就会按下。","Your colleagues probably don't agree with your conclusion.\nIf there were a button to silence you, they would likely press it without hesitation."
AvgDialog_19079_Content_21,agXT,avg章4_AvgDialog_C_M.csv,534,AvgDialog,Content,朵尔,那你可就低估了弥萨格的包容心和我的个人价值了。,Then you have underestimated Mythag's tolerance and my personal value.
AvgDialog_19079_Content_22,agXU,avg章4_AvgDialog_C_M.csv,535,AvgDialog,Content,赫伯特,是小人见识浅薄了，再有力的大脑，面对把你团团包围的怪物，也是束手无策吧？,"I suppose I am lacking in knowledge. However, no matter how powerful one's mind is, it is helpless against the monsters surrounding you, right?"
AvgDialog_19079_Content_23,agXV,avg章4_AvgDialog_C_M.csv,536,AvgDialog,Content,朵尔,"呵？束手无策。
你可看好了，我这替代了人类双手的，到底是什么东西。",Hah? Helpless?\nLook closely. What exactly has replaced my human hands?
AvgDialog_19079_Content_24,agXW,avg章4_AvgDialog_C_M.csv,537,AvgDialog,Content,朵尔,愿银钥指引前路。,May the Silver Key guide our way.
AvgDialog_19079_Content_25,agXX,avg章4_AvgDialog_C_M.csv,538,AvgDialog,Content,,朵尔的瞳孔开始变形。,Doll's pupils began to deform.
AvgDialog_19079_Content_26,agXY,avg章4_AvgDialog_C_M.csv,539,AvgDialog,Content,朵尔,做好准备了吗，阿米巴原虫们。,"Are you ready, amoebas?"
AvgDialog_19079_Content_27,agXZ,avg章4_AvgDialog_C_M.csv,540,AvgDialog,Content,赫伯特,等等！你不要命了吗？！,Wait! Are you trying to get yourself killed?!
AvgDialog_19079_Content_28,agYa,avg章4_AvgDialog_C_M.csv,541,AvgDialog,Content,,爆破声如同轰雷，响彻本就狭小不堪的走廊。,"The blast roared like thunder, echoing through the already cramped corridor."
AvgDialog_19079_Content_29,agYb,avg章4_AvgDialog_C_M.csv,542,AvgDialog,Content,,金属质的躯体四分五裂，飞溅刺入晦暗的墙面。,"The metallic body shatters, fragments scattering and piercing the dim wall."
AvgDialog_19079_Content_30,agYd,avg章4_AvgDialog_C_M.csv,543,AvgDialog,Content,,痛楚的怪叫声在瞬间爆发，又戛然而止。,"An anguished scream erupted abruptly, before coming to an abrupt stop."
AvgDialog_19079_Content_31,agYe,avg章4_AvgDialog_C_M.csv,544,AvgDialog,Content,,……随之而来的是数十秒的死寂，整座疗养院中只有滚滚浓烟弥漫。,"...followed by tens of seconds of deathly silence, with only thick smoke filling the entire sanatorium."
AvgDialog_19079_Content_32,agYf,avg章4_AvgDialog_C_M.csv,545,AvgDialog,Content,赫伯特,"咳、咳，朵尔这家伙……
幸亏我早有防备……","Cough, cough, that Doll...\nLucky for me, I was prepared..."
AvgDialog_19079_Content_33,agYg,avg章4_AvgDialog_C_M.csv,546,AvgDialog,Content,,赫伯特身前，实验体的血肉堆积成盾墙，密密麻麻的金属零件嵌入表皮和骨骼，显然已无一丝生机。,"In front of Herbert, the test subjects' bodies formed a defensive wall, with dense metal fragments embedded in their skin and bones; clearly devoid of any life."
AvgDialog_19079_Content_34,agYh,avg章4_AvgDialog_C_M.csv,547,AvgDialog,Content,赫伯特,这躯体爆破成这样，不知道从里面回收的东西还有多少作用……,With her body blown up this badly... I wonder how much of the salvaged material is still useful...
AvgDialog_19074_Content_1,agUp,avg章4_AvgDialog_C_M.csv,548,AvgDialog,Content,,秘窗,Secret Window
AvgDialog_19074_Content_2,agUA,avg章4_AvgDialog_C_M.csv,549,AvgDialog,Content,,你和拉蒙娜沿着走廊朝东奔跑，不多时，一堵墙出现在你们面前。,"You and Ramona run east along the corridor, and soon a wall appears before you."
AvgDialog_19074_Content_3,agUD,avg章4_AvgDialog_C_M.csv,550,AvgDialog,Content,,"白墙的高处挂着一幅简陋的幼童手绘画作，母亲抱着孩子嬉戏——
而那曾是孩子的地方，只残留下了黑色的黏液。","On the high white wall hangs a crude child's drawing: a mother playing with her child — \nBut where the child once was, only black slime remains."
AvgDialog_19074_Content_4,agUE,avg章4_AvgDialog_C_M.csv,551,AvgDialog,Content,玩家,没有路了？,Is this a dead end?
AvgDialog_19074_Content_5,agUF,avg章4_AvgDialog_C_M.csv,552,AvgDialog,Content,拉蒙娜,"不……相信你的直觉。
进去吧。",No... trust your instincts.\nLet's go in.
AvgDialog_19074_Content_6,agUG,avg章4_AvgDialog_C_M.csv,553,AvgDialog,Content,,"在迈入那面墙的瞬间，你仿佛看见墙面上的画动了一下——
女孩的身影在刹那间出现，又重新沉入黑暗。","As you step into the wall, you seem to see the painting move — \nThe girl's figure appears for a fleeting moment before sinking back into darkness."
AvgDialog_19074_Content_7,agUH,avg章4_AvgDialog_C_M.csv,554,AvgDialog,Content,玩家,这片空间……,This space...
AvgDialog_19074_Content_8,agUI,avg章4_AvgDialog_C_M.csv,555,AvgDialog,Content,拉蒙娜,如果我没猜错，这里是弗朗西斯的意识形成的通道。,"If I'm not mistaken, this is the passage formed by Francis's consciousness."
AvgDialog_19074_Content_9,agUJ,avg章4_AvgDialog_C_M.csv,556,AvgDialog,Content,萝坦,藏得真深啊。,She hid it quite well.
AvgDialog_19074_Content_10,agUq,avg章4_AvgDialog_C_M.csv,557,AvgDialog,Content,拉蒙娜,否则我们怎么会一无所获？,"Otherwise, how could we have ended up with nothing?"
AvgDialog_19074_Content_11,agUr,avg章4_AvgDialog_C_M.csv,558,AvgDialog,Content,玩家,远方的光……,That light in the distance...
AvgDialog_19074_Content_12,agUs,avg章4_AvgDialog_C_M.csv,559,AvgDialog,Content,拉蒙娜,是意识空间的主人内心最深的执念，不能遗忘之物。,It is the deepest obsession of the owner of this consciousness; something that cannot be forgotten.
AvgDialog_19074_Content_13,agUt,avg章4_AvgDialog_C_M.csv,560,AvgDialog,Content,玩家,看起来像是个表盘。,Looks like a watch face.
AvgDialog_19074_Content_14,agUu,avg章4_AvgDialog_C_M.csv,561,AvgDialog,Content,萝坦,那家伙难不成想做时间的主人？,Does she want to become the master of time or something?
AvgDialog_19074_Content_15,agUv,avg章4_AvgDialog_C_M.csv,562,AvgDialog,Content,拉蒙娜,她需要太多太多的时间来完成自己的目标，所以才自我禁锢在那个房间中吧。,"She probably needs more time to achieve her goals, so she confined herself in that room."
AvgDialog_19074_Content_16,agUw,avg章4_AvgDialog_C_M.csv,563,AvgDialog,Content,玩家,自我禁锢？,Self-imprisonment?
AvgDialog_19074_Content_17,agUx,avg章4_AvgDialog_C_M.csv,564,AvgDialog,Content,拉蒙娜,是的，维度旅行的代价可不是一般人能够承受的。,"Yes, the cost of dimensional travel is not something ordinary people can bear."
AvgDialog_19074_Content_18,agUy,avg章4_AvgDialog_C_M.csv,565,AvgDialog,Content,拉蒙娜,她每次离开房间，恐怕都承受着极高的风险——,"Every time she leaves the room, she likely faces immense risks—"
AvgDialog_19074_Content_19,agUz,avg章4_AvgDialog_C_M.csv,566,AvgDialog,Content,拉蒙娜,小心！,Watch out!
AvgDialog_19074_Content_20,agUB,avg章4_AvgDialog_C_M.csv,567,AvgDialog,Content,,混沌的三角怪物从脚下的黑泥中浮出。,A triangular monster of chaos emerges from the black mud beneath.
AvgDialog_19074_Content_21,agUC,avg章4_AvgDialog_C_M.csv,568,AvgDialog,Content,玩家,先离开这里！,Let's get out of here first!
AvgDialog_19071_Content_1,agSC,avg章4_AvgDialog_C_M.csv,569,AvgDialog,Content,,神秘河,Mystic River
AvgDialog_19071_Content_2,agSN,avg章4_AvgDialog_C_M.csv,570,AvgDialog,Content,拉蒙娜,快，出口就在眼前了！,"Quick, the exit is right in front of us!"
AvgDialog_19071_Content_3,agSY,avg章4_AvgDialog_C_M.csv,571,AvgDialog,Content,,你望向拉蒙娜所指之处，刺目的白光覆盖视野。,"You look where Ramona is pointing, and a blinding white light fills your vision."
AvgDialog_19071_Content_4,agTj,avg章4_AvgDialog_C_M.csv,572,AvgDialog,Content,,视觉消失在了粗粝的白色幻觉中，如患上了雪盲一般。,"Your sight disappeared into a coarse white phantasm, as if affected with snow blindness."
AvgDialog_19071_Content_5,agTu,avg章4_AvgDialog_C_M.csv,573,AvgDialog,Content,,"扭曲的混沌中，意识被拉出身体，知觉被送往了极远的、极寒的维度。
那个<Yellow:梦境>再度造访了你……","In the twisted chaos, your consciousness is pulled out of your body and sent to a distant, freezing dimension.\nThat <Yellow:Dream> visits you once again..."
AvgDialog_19071_Content_6,agTz,avg章4_AvgDialog_C_M.csv,574,AvgDialog,Content,,……,...
AvgDialog_19071_Content_7,agTA,avg章4_AvgDialog_C_M.csv,575,AvgDialog,Content,,艾尔沃斯发生的事早已超越了<Yellow:你>所知的常理，但现在你顾不上感到混乱，还有更重要的事情等着你去完成。,"The events in Elworth have long surpassed what <Yellow:you> know to be normal, but there's no time for confusion now. More important tasks await you."
AvgDialog_19071_Content_8,agTB,avg章4_AvgDialog_C_M.csv,576,AvgDialog,Content,弗朗西斯？,帮帮我…拦住他们。,Help me... hold them back.
AvgDialog_19071_Content_9,agTC,avg章4_AvgDialog_C_M.csv,577,AvgDialog,Content,纯白的少女,好的，主人。,"Yes, Master."
AvgDialog_19071_Content_10,agSD,avg章4_AvgDialog_C_M.csv,578,AvgDialog,Content,,黑色的眼球发出古怪的咯叽咯叽声，少女的双唇一张一合，发出的呓语声与眼球的怪声奏成一曲低迷压抑的交响乐。,"The black eyeballs emit a strange ""clicking"" sound. The girl's lips move, her murmurs blending with the eerie noise into a symphony of gloom and oppression."
AvgDialog_19071_Content_11,agSE,avg章4_AvgDialog_C_M.csv,579,AvgDialog,Content,纯白的少女,<Shake:@2——@1——>,<Shake:@2—@1—>
AvgDialog_19071_Content_12,agSF,avg章4_AvgDialog_C_M.csv,580,AvgDialog,Content,,黑色的怪球向教徒扑去，人群开始骚动起来。,"The black monster ball lunged at the cultist, causing the cultists to riot."
AvgDialog_19071_Content_13,agSG,avg章4_AvgDialog_C_M.csv,581,AvgDialog,Content,,你和伯特兰上校抓紧混乱的空隙，钻入小道之中。,"You and Colonel Bertrand seize the opportunity amidst the chaos, slipping into a narrow alley."
AvgDialog_19071_Content_14,agSH,avg章4_AvgDialog_C_M.csv,582,AvgDialog,Content,,……,...
AvgDialog_19071_Content_15,agSI,avg章4_AvgDialog_C_M.csv,583,AvgDialog,Content,,…………,...
AvgDialog_19071_Content_16,agSJ,avg章4_AvgDialog_C_M.csv,584,AvgDialog,Content,,在黑暗中行进了不知道多久，身后不远处始终有嘶吼声、怪叫声、喘息声、呢喃声和呓语声传来。,"You travel in the darkness for an unknown amount of time—roars, strange noises, gasps, whispers, and murmurs following shortly behind you the entire time."
AvgDialog_19071_Content_17,agSK,avg章4_AvgDialog_C_M.csv,585,AvgDialog,Content,伯特兰,快，踩着我的肩膀，你先爬上去！,"Quick, step on my shoulders and climb up first!"
AvgDialog_19071_Content_18,agSL,avg章4_AvgDialog_C_M.csv,586,AvgDialog,Content,,"在伯特兰上校的托举下，你先行钻出了狭窄的地道。
出现在面前的是足以让人目眩的皑皑雪原。","With Colonel Bertrand's help, you were the first to crawl out of the narrow tunnel.\nBefore you lay a dazzling, snow-covered plain."
AvgDialog_19071_Content_19,agSM,avg章4_AvgDialog_C_M.csv,587,AvgDialog,Content,弗朗西斯？,稍等，我有点雪盲……我马上就来拉你……,"Hold on, I'm a bit snow-blind... I'll come and pull you up right away."
AvgDialog_19071_Content_20,agSO,avg章4_AvgDialog_C_M.csv,588,AvgDialog,Content,伯特兰,没关系，我自己可以……,"It's fine, I can handle it myself..."
AvgDialog_19071_Content_21,agSP,avg章4_AvgDialog_C_M.csv,589,AvgDialog,Content,,伯特兰上校的话音未落，猝然之间，他的脸上写满了惊恐。,Colonel Bertrand hadn't finished speaking when his face suddenly filled with terror.
AvgDialog_19071_Content_22,agSQ,avg章4_AvgDialog_C_M.csv,590,AvgDialog,Content,,在他与地道出口的罅隙之间，钻出了无数粗壮而扭曲的液态枝条。,"Countless thick, twisted liquid tendrils emerged from the gap between him and the tunnel exit."
AvgDialog_19071_Content_23,agSR,avg章4_AvgDialog_C_M.csv,591,AvgDialog,Content,,那东西仿佛有自主意志，紧紧缠住了伯特兰上校的躯体。,"That thing seemed to have a will of its own, tightly wrapping around Colonel Bertrand's body."
AvgDialog_19071_Content_24,agSS,avg章4_AvgDialog_C_M.csv,592,AvgDialog,Content,,伯特兰伸出五指紧紧抓住地表，但无济于事，只有白雪覆盖的地面没有任何着力点，他在呼吸之间就被拖了下去。,"Bertrand clawed at the ground with his fingers, but to no avail. The snow-covered surface offered no grip, and in an instant, he was dragged away."
AvgDialog_19071_Content_25,agST,avg章4_AvgDialog_C_M.csv,593,AvgDialog,Content,,紧接着，耳膜接收到了令人神经紧绷的声音……,"Next, your eardrums picked up a nerve-racking sound..."
AvgDialog_19071_Content_26,agSU,avg章4_AvgDialog_C_M.csv,594,AvgDialog,Content,,"蠕动，咀嚼，骨质碰撞……
就连消化液与有机物发生反应的声音都如此清晰。","Squirming, chewing, the clatter of bone against bone...\nEven the sound of digestive fluids reacting with organic matter was far too distinct for comfort."
AvgDialog_19071_Content_27,agSV,avg章4_AvgDialog_C_M.csv,595,AvgDialog,Content,,"……数秒的惊心动魄之后，一切归于沉寂。
只有雪风吹落枝头积雪，扑簌地落在雪地上。","...After a few heart-stopping seconds, everything fell silent.\nOnly the wind blew the snow off the branches, softly landing on the snowy ground."
AvgDialog_19071_Content_28,agSW,avg章4_AvgDialog_C_M.csv,596,AvgDialog,Content,,迟来的反胃感自腹腔涌上胸口，你对着雪地干呕起来。,"A delayed wave of nausea rises from your abdomen to your chest, causing you to retch into the snow."
AvgDialog_19071_Content_29,agSX,avg章4_AvgDialog_C_M.csv,597,AvgDialog,Content,弗朗西斯？,呕……,Ugh...
AvgDialog_19071_Content_30,agSZ,avg章4_AvgDialog_C_M.csv,598,AvgDialog,Content,,泪水不受控地从眼眶溢出，你分不清是充斥胸膛的悲伤还是恐惧。,"Tears overflow uncontrollably from your eyes, and you can't tell whether it's sorrow or fear filling your chest."
AvgDialog_19071_Content_31,agTa,avg章4_AvgDialog_C_M.csv,599,AvgDialog,Content,,"你去摸口袋里的怀表，希望它能给你些许安慰。
但那里空空如也，什么都没有。","You reach into your pocket for your pocketwatch, hoping it will bring you some comfort.\nBut it's empty—there's nothing there."
AvgDialog_19071_Content_32,agTb,avg章4_AvgDialog_C_M.csv,600,AvgDialog,Content,,……原来你什么都没能取回来。,"...So, you came back empty-handed."
AvgDialog_19071_Content_33,agTc,avg章4_AvgDialog_C_M.csv,601,AvgDialog,Content,,身体一沉，冰冷的掌心搭上了你的肩头。,Your body feels heavy as a cold palm rests on your shoulder.
AvgDialog_19071_Content_34,agTd,avg章4_AvgDialog_C_M.csv,602,AvgDialog,Content,纯白的少女,危险，主人。请给我命令。,"It's dangerous, Master. Please give me orders."
AvgDialog_19071_Content_35,agTe,avg章4_AvgDialog_C_M.csv,603,AvgDialog,Content,,……,...
AvgDialog_19071_Content_36,agTf,avg章4_AvgDialog_C_M.csv,604,AvgDialog,Content,,…………,...
AvgDialog_19071_Content_37,agTg,avg章4_AvgDialog_C_M.csv,605,AvgDialog,Content,,"经过几日跋涉，那些追赶你们的怪物和教徒都消失在了雪原中。
你和女孩扫去了些积雪，依偎在篝火旁休息。","After several days of trekking, the monsters and cultists chasing you have disappeared into the snowfield.\nYou and the girl brushed away some snow and huddled by the campfire to rest."
AvgDialog_19071_Content_38,agTh,avg章4_AvgDialog_C_M.csv,606,AvgDialog,Content,,她时不时会离开你，然后带回一些不知道是什么生物的带血肉块。,"She occasionally leaves you, then returns with bloody chunks of unknown creatures."
