StageGroup_15935_Name,aRcG,g关卡组_StageGroup_A.csv,8,StageGroup,Name,,入学日,Enrollment Day
StageGroup_15935_Desc,aRcF,g关卡组_StageGroup_A.csv,8,StageGroup,Desc,,启程日，钥冢细雨霏霏。在这里埋下你的墓碑、姓名和誓言。,"On this day of departure, a gentle drizzle falls over the Keygrave.\nHere, you shall bury your tombstone, your name, and your oath."
StageGroup_15927_Desc,aRbZ,g关卡组_StageGroup_A.csv,9,StageGroup,Desc,,古老的伦蒂尼恩夜雾弥漫，在昏黄路灯无法照亮的角落，黑暗正伺机而动。,"Mist shrouds the ancient city of Londinium, and darkness lurks where the dim streetlights fail to reach."
StageGroup_15922_Desc,aRbF,g关卡组_StageGroup_A.csv,11,StageGroup,Desc,,欢迎来到热情好客的拉伊小镇——冬夜的犬吠会让每位来访者宾至如归。,Welcome to the hospitable town of Rye—where the barking of dogs on winter nights makes every visitor feel at home.
StageGroup_15882_Desc,aQYB,g关卡组_StageGroup_A.csv,12,StageGroup,Desc,,与“歇斯底里”的刻板印象相悖，此处是静止的无声世界。,"Contrary to the stereotype of ""hysteria,"" this is a still and silent world."
StageGroup_15907_Name,aRay,g关卡组_StageGroup_A.csv,13,StageGroup,Name,,风暴之眼,Eye of the Storm
StageGroup_15907_Desc,aRax,g关卡组_StageGroup_A.csv,13,StageGroup,Desc,,陌生的船只，陌生的少女，陌生的敌人。飘摇于大海之中，等待着调查员们的，是一场与命运的抗争……,"A strange ship; a strange girl; and strange enemies. Adrift upon the sea, what awaits our investigators is a struggle against fate..."
StageGroup_15890_Desc,aQZh,g关卡组_StageGroup_A.csv,14,StageGroup,Desc,,群星落入深海，在海底闪烁着无人能解读的愿望。,"Stars fall into the abyss, shimmering with wishes that no one can decipher."
StageGroup_48870_Desc,aRmB,g关卡组_StageGroup_A.csv,15,StageGroup,Desc,,勒姆瓦希，卡达斯中部地带的黄沙之国。在被当地人称为“圣河”的母亲河哺育下，名为亚兰的文明正在暗中滋长与消亡……,"Remouahe, a desert nation located in central Kadath.\nNurtured by the ""Holy River,"" the Aram civilization quietly rises—and quietly, it fades away..."
StageGroup_58900_Desc,aRBx,g关卡组_StageGroup_A.csv,16,StageGroup,Desc,,入场。静坐。等待。渴求。\n指挥棒轻轻扬起。准备好，聆听这宇宙最深邃的隐秘了吗？,"Enter. Sit. Wait. Yearn.\nGently, the baton rises. Are you ready to listen to the deepest secrets of the universe?"
StageGroup_67786_Desc,aRCt,g关卡组_StageGroup_A.csv,17,StageGroup,Desc,,祂做了一场漫长的梦。\n祂梦见神与星辰，梦见尘埃衍化文明，文明化为尘埃。\n祂梦见恨与爱，梦见欢愉与恐惧。 \n祂从睡梦中惊醒。梦境中的一切，从未存在。,"It had a long dream.\nIt dreamed of gods and stars; of dust giving rise to civilization, and of civilization returning to dust.\nIt dreamed of hate and love; of joy and fear.\nIt woke with a start. Everything in its dream—had never existed."
StageGroup_15917_Desc,aRbl,g关卡组_StageGroup_A.csv,18,StageGroup,Desc,,古老的伦蒂尼恩夜雾弥漫，在昏黄路灯无法照亮的角落，黑暗正伺机而动。,"Mist shrouds the ancient city of Londinium, and darkness lurks where the dim streetlights fail to reach."
StageGroup_15917_TypeText,aRbo,g关卡组_StageGroup_A.csv,18,StageGroup,TypeText,,调查困难,Investigation Hard
StageGroup_15895_TypeText,aQZE,g关卡组_StageGroup_A.csv,19,StageGroup,TypeText,,调查困难,Investigation Hard
StageGroup_15906_Desc,aRat,g关卡组_StageGroup_A.csv,20,StageGroup,Desc,,欢迎来到热情好客的拉伊小镇——冬夜的犬吠会让每位来访者宾至如归。,Welcome to the hospitable town of Rye—where the barking of dogs on winter nights makes every visitor feel at home.
StageGroup_15906_TypeText,aRaw,g关卡组_StageGroup_A.csv,20,StageGroup,TypeText,,调查困难,Investigation Hard
StageGroup_15921_Desc,aRbB,g关卡组_StageGroup_A.csv,21,StageGroup,Desc,,与“歇斯底里”的刻板印象相悖，此处是静止的无声世界。,"Contrary to the stereotype of ""hysteria,"" this is a still and silent world."
StageGroup_15921_TypeText,aRbE,g关卡组_StageGroup_A.csv,21,StageGroup,TypeText,,调查困难,Investigation Hard
StageGroup_15905_Name,aRaq,g关卡组_StageGroup_A.csv,22,StageGroup,Name,,风暴之眼,Eye of the Storm
StageGroup_15905_Desc,aRap,g关卡组_StageGroup_A.csv,22,StageGroup,Desc,,陌生的船只，陌生的少女，陌生的敌人。飘摇于大海之中，等待着调查员们的，是一场与命运的抗争……,"A strange ship; a strange girl; and strange enemies. Adrift upon the sea, what awaits our investigators is a struggle against fate..."
StageGroup_15905_TypeText,aRas,g关卡组_StageGroup_A.csv,22,StageGroup,TypeText,,调查困难,Investigation Hard
StageGroup_15946_Desc,aRdx,g关卡组_StageGroup_A.csv,23,StageGroup,Desc,,群星落入深海，在海底闪烁着无人能解读的愿望。,"Stars fall into the abyss, shimmering with wishes that no one can decipher."
StageGroup_15946_TypeText,aRdA,g关卡组_StageGroup_A.csv,23,StageGroup,TypeText,,调查困难,Investigation Hard
StageGroup_48869_Desc,aRmx,g关卡组_StageGroup_A.csv,24,StageGroup,Desc,,勒姆瓦希，卡达斯中部地带的黄沙之国。在被当地人称为“圣河”的母亲河哺育下，名为亚兰的文明正在暗中滋长与消亡……,"Remouahe, a desert nation located in central Kadath.\nNurtured by the ""Holy River,"" the Aram civilization quietly rises—and quietly, it fades away..."
StageGroup_48869_TypeText,aRmA,g关卡组_StageGroup_A.csv,24,StageGroup,TypeText,,调查困难,Investigation Hard
StageGroup_58906_Desc,aRBJ,g关卡组_StageGroup_A.csv,25,StageGroup,Desc,,入场。静坐。等待。渴求。\n指挥棒轻轻扬起。准备好，聆听这宇宙最深邃的隐秘了吗？,"Enter. Sit. Wait. Yearn.\nGently, the baton rises. Are you ready to listen to the deepest secrets of the universe?"
StageGroup_58906_TypeText,aRBM,g关卡组_StageGroup_A.csv,25,StageGroup,TypeText,,调查困难,Investigation Hard
StageGroup_67785_Desc,aRCp,g关卡组_StageGroup_A.csv,26,StageGroup,Desc,,祂做了一场漫长的梦。\n祂梦见神与星辰，梦见尘埃衍化文明，文明化为尘埃。\n祂梦见恨与爱，梦见欢愉与恐惧。 \n祂从睡梦中惊醒。梦境中的一切，从未存在。,"It had a long dream.\nIt dreamed of gods and stars; of dust giving rise to civilization, and of civilization returning to dust.\nIt dreamed of hate and love; of joy and fear.\nIt woke with a start. Everything in its dream—had never existed."
StageGroup_15896_Desc,aQZF,g关卡组_StageGroup_A.csv,27,StageGroup,Desc,,古老的伦蒂尼恩夜雾弥漫，在昏黄路灯无法照亮的角落，黑暗正伺机而动。,"Mist shrouds the ancient city of Londinium, and darkness lurks where the dim streetlights fail to reach."
StageGroup_15913_Desc,aRaV,g关卡组_StageGroup_A.csv,29,StageGroup,Desc,,欢迎来到热情好客的拉伊小镇——冬夜的犬吠会让每位来访者宾至如归。,Welcome to the hospitable town of Rye—where the barking of dogs on winter nights makes every visitor feel at home.
StageGroup_15925_Desc,aRbR,g关卡组_StageGroup_A.csv,30,StageGroup,Desc,,与“歇斯底里”的刻板印象相悖，此处是静止的无声世界。,"Contrary to the stereotype of ""hysteria,"" this is a still and silent world."
StageGroup_15919_Name,aRbu,g关卡组_StageGroup_A.csv,31,StageGroup,Name,,风暴之眼(未完成),Eye of the Storm (Incomplete)
StageGroup_15919_Desc,aRbt,g关卡组_StageGroup_A.csv,31,StageGroup,Desc,,陌生的船只，陌生的少女，陌生的敌人。飘摇于大海之中，等待着调查员们的，是一场与命运的抗争……,"A strange ship; a strange girl; and strange enemies. Adrift upon the sea, what awaits our investigators is a struggle against fate..."
StageGroup_15920_Desc,aRbx,g关卡组_StageGroup_A.csv,32,StageGroup,Desc,,群星落入深海，在海底闪烁着无人能解读的愿望。,"Stars fall into the abyss, shimmering with wishes that no one can decipher."
StageGroup_48868_Desc,aRmt,g关卡组_StageGroup_A.csv,33,StageGroup,Desc,,勒姆瓦希，卡达斯中部地带的黄沙之国。在被当地人称为“圣河”的母亲河哺育下，名为亚兰的文明正在暗中滋长与消亡……,"Remouahe, a desert nation located in central Kadath.\nNurtured by the ""Holy River,"" the Aram civilization quietly rises—and quietly, it fades away..."
StageGroup_58904_Desc,aRBF,g关卡组_StageGroup_A.csv,34,StageGroup,Desc,,入场。静坐。等待。渴求。\n指挥棒轻轻扬起。准备好，聆听这宇宙最深邃的隐秘了吗？,"Enter. Sit. Wait. Yearn.\nGently, the baton rises. Are you ready to listen to the deepest secrets of the universe?"
StageGroup_67787_Desc,aRCx,g关卡组_StageGroup_A.csv,35,StageGroup,Desc,,祂做了一场漫长的梦。\n祂梦见神与星辰，梦见尘埃衍化文明，文明化为尘埃。\n祂梦见恨与爱，梦见欢愉与恐惧。 \n祂从睡梦中惊醒。梦境中的一切，从未存在。,"It had a long dream.\nIt dreamed of gods and stars; of dust giving rise to civilization, and of civilization returning to dust.\nIt dreamed of hate and love; of joy and fear.\nIt woke with a start. Everything in its dream—had never existed."
StageGroup_70939_Desc,aRGV,g关卡组_StageGroup_A.csv,36,StageGroup,Desc,,被灰雾埋葬的旧日废都\n跨越无光的星辰，与无上意志的碎念在毁损维度重逢,"Buried in the gray mist lies the ruins of an ancient city.\nTraverse the void of lightless stars, reuniting with the fragmented thoughts of the Supreme Will in a damaged Dimension."
StageGroup_70938_Desc,bqZb,g关卡组_StageGroup_A.csv,37,StageGroup,Desc,,群体潜意识构筑的疗养院\n在这里，躯壳的消解并非终点，心灵的死亡才是终结。\n踏入者啊，请保持理智，人性是你穿行心灵迷宫的唯一依仗。,"A sanatorium constructed by the collective subconscious.\nHere, the dissolution of the shell is not the end; the death of the mind is.\nThose who enter, please maintain your sanity. Your humanity shall be your only recourse as you traverse the maze of your mind."
StageGroup_70940_Desc,bzad,g关卡组_StageGroup_A.csv,38,StageGroup,Desc,,欢庆吧，我的朋友♪\n月光下的骸骨悄然绽放，一位挚爱被送上餐盘♪\n所有的宾客都已到来！唱呀，跳呀♪\n我们从不为亡灵祈祷，我们从不为尸首哀悼♪\n她将记忆交予了我，她将眼泪交予了我♪\n让我们咽下她的魂灵与腐肉♪\n在死亡的盛宴中，我们再度重圆♪,"Rejoice, my friend♪\nBeneath the moonlight, bones quietly bloom♪\nMy beloved lies still on a silver plate♪\nAll the guests have arrived! Sing! Dance!♪\nWe never pray for the dead, we never mourn the corpses♪\nShe gave me her memories, she gave me her tears♪\nLet us swallow her soul, her decaying flesh♪\nIn this feast of death, we are reunited once more♪"
StageGroup_72075_Desc,aRHd,g关卡组_StageGroup_A.csv,39,StageGroup,Desc,,被灰雾埋葬的旧日废都\n跨越无光的星辰，与无上意志的碎念在毁损维度重逢,"Buried in the gray mist lies the ruins of an ancient city.\nTraverse the void of lightless stars, reuniting with the fragmented thoughts of the Supreme Will in a damaged Dimension."
StageGroup_72074_Desc,bqZf,g关卡组_StageGroup_A.csv,40,StageGroup,Desc,,群体潜意识构筑的疗养院\n在这里，躯壳的消解并非终点，心灵的死亡才是终结。\n踏入者啊，请保持理智，人性是你穿行心灵迷宫的唯一依仗。,"A sanatorium constructed by the collective subconscious.\nHere, the dissolution of the shell is not the end; the death of the mind is.\nThose who enter, please maintain your sanity. Your humanity shall be your only recourse as you traverse the maze of your mind."
StageGroup_72073_Desc,bzag,g关卡组_StageGroup_A.csv,41,StageGroup,Desc,,欢庆吧，我的朋友♪\n月光下的骸骨悄然绽放，一位挚爱被送上餐盘♪\n所有的宾客都已到来！唱呀，跳呀♪\n我们从不为亡灵祈祷，我们从不为尸首哀悼♪\n她将记忆交予了我，她将眼泪交予了我♪\n让我们咽下她的魂灵与腐肉♪\n在死亡的盛宴中，我们再度重圆♪,"Rejoice, my friend♪\nBeneath the moonlight, bones quietly bloom♪\nMy beloved lies still on a silver plate♪\nAll the guests have arrived! Sing! Dance!♪\nWe never pray for the dead, we never mourn the corpses♪\nShe gave me her memories, she gave me her tears♪\nLet us swallow her soul, her decaying flesh♪\nIn this feast of death, we are reunited once more♪"
Stage_8128_Name,aVtf,g关卡_Stage_A.csv,69,Stage,Name,,漆黑之梦,Pitch-Black Dream
Stage_8128_Desc,aVte,g关卡_Stage_A.csv,69,Stage,Desc,,没有供给呼吸的氧气，没有火柴般微弱的光亮，这里是绝对的漆黑之梦。,"No oxygen to breathe, not even the faint light of a match; this is an absolutely pitch-black dream."
Stage_8126_Desc,aVsY,g关卡_Stage_A.csv,70,Stage,Desc,,你与拉蒙娜前往伦蒂尼恩东区的莉莉安济贫院，展开你作为新晋守密人的第一次调查。\n一切都会很顺利，对吧？,"You and Ramona head to the Lillian Orphanage located in the eastern district of Londinium for your first investigation as a new Keeper.\nEverything will go smoothly, right?"
Stage_8127_Desc,aVtb,g关卡_Stage_A.csv,71,Stage,Desc,,幽灵藏于幽暗之处——地底或是人心。,Ghosts lurk in the shadows—whether it be underground or within the human heart.
Stage_8185_Name,aVwr,g关卡_Stage_A.csv,72,Stage,Name,,小小侦探,Tiny Detective
Stage_8185_Desc,aVwq,g关卡_Stage_A.csv,72,Stage,Desc,,我们一定会找回重要之人。\n这是小侦探与小小侦探的约定。,We will definitely find the important person.\nThis is the promise between the Little Detective and the Tiny Detective.
Stage_8188_Desc,aVwz,g关卡_Stage_A.csv,75,Stage,Desc,,在笼罩济贫院的浓厚迷雾之中，触碰切割、消失与死亡。,"Within the dense mist shrouding the almshouse, one encounters cutting, vanishing, and death."
Stage_8121_Desc,aVsJ,g关卡_Stage_A.csv,77,Stage,Desc,,我多想永远不用长大，每一天都和你这样看星星。\n我多想快一点快一点长大，就能保护你们所有人。,"How I wish that I never had to grow up, so that I could spend every day stargazing with you.\nHow I wish that I could grow up faster, so that I could protect all of you."
Stage_7685_Name,aUDG,g关卡_Stage_A.csv,79,Stage,Name,,良心之重,Burden of Conscience
Stage_7889_Name,aVfq,g关卡_Stage_A.csv,82,Stage,Name,,一切如常,Business as usual
Stage_7989_Desc,aVlj,g关卡_Stage_A.csv,88,Stage,Desc,,位于北约克郡的海边小镇——斯卡伯勒。这里拥有高耸的悬崖与金色的海湾，是一处优雅迷人的度假胜地。,"A seaside town in North Yorkshire—Scarborough. Featuring towering cliffs and golden bays, it is an elegant and charming holiday destination."
Stage_7983_Desc,aVkR,g关卡_Stage_A.csv,91,Stage,Desc,,一只小老鼠，一只小老鼠。\n跑啊，跑啊，她用切肉刀割掉它的尾巴。,"One little mouse, one little mouse.\nRun, run! She cut off its tail with a cleaver."
Stage_7751_Desc,aUVz,g关卡_Stage_A.csv,95,Stage,Desc,,没错，宝贝。尽情地哭吧，把你的痛苦当作绝世名作一样装裱起来。,"That's right, baby. Cry all you want, and frame your pain like a masterpiece."
Stage_7750_Name,aUVx,g关卡_Stage_A.csv,96,Stage,Name,,不朽的低语,Whispers of the Immortal
Stage_7755_Desc,aUVL,g关卡_Stage_A.csv,99,Stage,Desc,,后来，勇士回到故乡，娶了公主为妻，过上了幸福平静的生活。\n真的吗？假的。,"The warrior later returned to his home, married the princess, and lived a happy and peaceful life.\nReally? Nope, not really."
Stage_8110_Desc,aVsc,g关卡_Stage_A.csv,100,Stage,Desc,,追溯地狱犬“刻耳柏洛斯”的流言，弥萨格的调查员们来到伦蒂尼恩远郊的小镇拉伊，探寻失踪案背后的隐秘……,"Following rumors of the hellhound ""Cerberus,"" Mythag investigators arrive at the outskirts of a small town called Rye near Londinium, looking to uncover the mystery behind the disappearances..."
Stage_8111_Name,aVsg,g关卡_Stage_A.csv,101,Stage,Name,,好消息，坏消息,"Good News, Bad News"
Stage_8113_Desc,aVsl,g关卡_Stage_A.csv,103,Stage,Desc,,癫狂的语调，浓烈的腥气，这就是来自拉伊的欢迎仪式。,A frenzied tone; a bloody stench—this is the welcome ceremony of Rye.
Stage_8114_Name,aVsp,g关卡_Stage_A.csv,104,Stage,Name,,袖中王牌,Ace Up My Sleeve
Stage_8115_Name,aVss,g关卡_Stage_A.csv,105,Stage,Name,,芒刺在背,Thorn In My Side
Stage_8115_Desc,aVsr,g关卡_Stage_A.csv,105,Stage,Desc,,达芙黛尔请来了你们的“答案”，新的棋子迈入棋盘，带来关于风雪的梦境。,"Daffodil has brought you your ""answer."" A new piece steps onto the board, bringing a dream of wind and snow."
Stage_8116_Desc,aVsu,g关卡_Stage_A.csv,106,Stage,Desc,,祝您旅途愉快。,Wishing you a pleasant journey.
Stage_8117_Desc,aVsx,g关卡_Stage_A.csv,107,Stage,Desc,,在地铁内，你们遭到了神秘刺客的袭击……,"In the subway, you were attacked by a mysterious assassin..."
Stage_8118_Desc,aVsA,g关卡_Stage_A.csv,108,Stage,Desc,,与达芙黛尔夫人的往来，永远是由交易构成的。达芙黛尔出现，向你们提出了交易，而神秘的袭击者是否会认可这一交易呢？,"Interactions with the Lady Daffodil are always transactional. Lady Daffodil appears and proposes a deal, but will the mysterious attacker accept this transaction?"
Stage_8042_Desc,aVom,g关卡_Stage_A.csv,112,Stage,Desc,,荒芜的铁路桥下，庞大臃肿的怪物发出古怪的低吼。要抵达拉伊疯人院，就必须跨过这里。,"Under the desolate railway bridge, a massive, bloated monster emits strange growls. To reach the Rye Sanatorium, you must first cross here."
Stage_8026_Desc,aVnq,g关卡_Stage_A.csv,115,Stage,Desc,,当勋贵们痛失权柄，当豪富们倾家荡产，他们寸步难行，就像你现在这样。,"When the nobles lose their power and the wealthy lose their fortunes, they are rendered helpless—just as you are now."
Stage_8031_Name,aVnG,g关卡_Stage_A.csv,118,Stage,Name,,记忆碎片,Memory Fragments
Stage_8031_Desc,aVnF,g关卡_Stage_A.csv,118,Stage,Desc,,日记是记忆的碎片。\n调查中总是会发现日记的。,Diaries are fragments of memory.\nDiaries are always discovered during investigations.
Stage_7867_Desc,aVdP,g关卡_Stage_A.csv,124,Stage,Desc,,你沉睡在夜晚的寂静之中，\n没有剩下任何的疑惑或争端，\n就像拥有永恒的拥抱，\n我们躺在平静的安定之中。,"You sleep in the stillness of the night, with no doubts or disputes remaining;\nlike an eternal embrace, we rest in tranquil peace."
Stage_7866_Name,aVdN,g关卡_Stage_A.csv,125,Stage,Name,,她,Her
Stage_7866_Desc,aVdM,g关卡_Stage_A.csv,125,Stage,Desc,,孩子向母亲伸出双手，祈求一个充满疼痛的拥抱。\n即使注射针刺破纤嫩表皮，手术刀划开洁白肌肤，束缚带捆扎柔弱关节。\n蔓延的无边疼痛依然无法阻止她们相拥。\n因为，这是最温暖的拥抱。自胚胎脱出母体，生出嫌隙，磨出锋锐，相互伤害，最终回归亲密，融为一体。,"The child reaches out to her mother, begging for an embrace filled with pain. \nEven as the injection needle pierces her tender skin, the scalpel cuts through her pale flesh, and the restraints bind her fragile joints. \nThe growing, endless pain still cannot stop their embrace. \nFor this is the warmest embrace—from the moment the embryo left her mother's womb, estrangement grows; sharpness is honed; and mutual harm ensues—ultimately returning to intimacy, merging into one."
Stage_7871_Desc,aVeb,g关卡_Stage_A.csv,127,Stage,Desc,,锋锐的利刺打破绝对的圆弧，并非“刻耳柏洛斯”之物自裂隙生出。,"Sharp spines pierced through the previously flawless arc—what emerged from the rift was something other than ""Cerberus""."
Stage_8153_Desc,aVuy,g关卡_Stage_A.csv,130,Stage,Desc,,老套的开局：落单的失忆守密人。\n不同的是，这次是在孤独的大海上醒来。,"A cliché start: a lone amnesiac Keeper.\nThe difference is that this time, {Male=he,Female=she} awakens on the lonely sea."
Stage_8151_Desc,aVus,g关卡_Stage_A.csv,131,Stage,Desc,,既视感与现实正在将守密人撕成两半，一半留给记忆，一半留在眼前。,"Déjà vu and reality are tearing the Keeper in two—one half left in memory, the other half left in the present."
Stage_8152_Name,aVuw,g关卡_Stage_A.csv,132,Stage,Name,,十面埋伏,Ambushed From All Sides
Stage_8152_Desc,aVuv,g关卡_Stage_A.csv,132,Stage,Desc,,夜晚的港口，淳朴的居民，热情的款待。,"The port at night, the simple residents, and their warm hospitality."
Stage_8156_Desc,aVuH,g关卡_Stage_A.csv,133,Stage,Desc,,退无可退之时，训练有素的伙伴往往是破局的关键——拉蒙娜再次教会了你这点。,"When there's no way out, a well-trained partner is often the key to breaking through—Ramona has taught you this lesson once again."
Stage_8157_Desc,aVuK,g关卡_Stage_A.csv,134,Stage,Desc,,踏破诸海而过的，除了敌人，或许还有希望的微光。,"Traversing across the many seas—besides enemies, perhaps there may also be a glimmer of hope."
Stage_8158_Desc,aVuN,g关卡_Stage_A.csv,137,Stage,Desc,,那是意图斩破海洋之人的巨刃，是意图踏平诸海之人的野心。,It was the colossal blade of one who intended to cleave the ocean; it was the ambition of one who intended to subjugate all seas.
Stage_8176_Desc,aVvP,g关卡_Stage_A.csv,140,Stage,Desc,,第二颗心脏在墨菲体内跳动着，阻止「降生仪式」迫在眉睫。,"A second heart beats within Murphy—we must prevent the imminent ""Birth Ritual""."
Stage_8022_Desc,aVne,g关卡_Stage_A.csv,146,Stage,Desc,,那绝非受到期待的生命，只是污浊的寄生虫罢了。,That was not a being that was ever desired; merely a filthy parasite.
Stage_7664_Desc,aUCc,g关卡_Stage_A.csv,147,Stage,Desc,,驶向陆地，驶向一线生机。,Sail towards land—towards a glimmer of hope.
Stage_8015_Desc,aVmJ,g关卡_Stage_A.csv,149,Stage,Desc,,夜色被暗流侵蚀，星辰失声。潜藏着转折与风雨的危机之月，静默映照着未知的未来。,"The night is eroded by undercurrents, and the stars fall silent. The crisis moon, fraught with twists and storms, quietly reflects an unknown future."
Stage_8018_Desc,aVmS,g关卡_Stage_A.csv,150,Stage,Desc,,在无尽夜幕的漆黑中追逐着那诱人的光明，犹如一只逐火之蛾，不顾一切地向着命运的焰火翱翔。,"Chasing the alluring light within the endless darkness of night, like a moth drawn to a flame; soaring toward the flames of destiny, heedless of all else."
Stage_7885_Desc,aVfd,g关卡_Stage_A.csv,154,Stage,Desc,,在命运的狂风中颤抖、挣扎，但它不会真正地飘零。,"You may tremble and struggle in the stormy winds of fate, but you will never truly drift away."
Stage_35857_Desc,aSeU,g关卡_Stage_A.csv,159,Stage,Desc,,群星去向了它们应去之处，相互间以一种超脱于人类理解的方式交流，编织出一张看不见的网，捕捉着流动的时间和逝去的光年。,"The stars have gone where they belong, communicating in ways beyond human understanding; weaving an invisible web that captures the flow of time and the light of bygone years."
Stage_48075_Desc,aSwz,g关卡_Stage_A.csv,170,Stage,Desc,,注意留心棋盘对面的阴影。\n真正的对手，向来不在棋局之内。,Pay close attention to the shadows on the other side of the board.\nThe true opponent is never within the game.
Stage_48074_Desc,aSww,g关卡_Stage_A.csv,173,Stage,Desc,,命运如密集的织网，所有线索于终点交汇，以死亡作注解。,"Fate is a densely-woven web—all threads converge at the end, with death as the annotation."
Stage_48070_Desc,aSwk,g关卡_Stage_A.csv,176,Stage,Desc,,母树重诞圣河，为已逝者加冕，将血脉还于亚兰。,"The Mother Tree rises anew: her roots drink deep the Holy River's flow.\nShe crowns the fallen in light, and calls their blood back to Aram's own."
Stage_48068_Desc,aSwe,g关卡_Stage_A.csv,178,Stage,Desc,,火是千年古树熊熊燃烧的热度。\n种是万代传承绵延不息的希望。,Fire is the blazing heat of a millennium-old tree.\nSeeds are the enduring hope passed down through countless generations.
Stage_48069_Desc,aSwh,g关卡_Stage_A.csv,179,Stage,Desc,,钥冢雨落不歇。,The rain over the Keygrave never stops.
Stage_58986_Name,aTJT,g关卡_Stage_A.csv,180,Stage,Name,,入场,Admission
Stage_58986_Desc,aTJS,g关卡_Stage_A.csv,180,Stage,Desc,,嘘。\n最后的听众已然落座，真正的演出，就要开始了。,Shh.\nThe last of the audience has taken their seats. The true performance is about to begin.
Stage_58988_Desc,aTJY,g关卡_Stage_A.csv,181,Stage,Desc,,「弥萨格独立于雷欧王国政府及密斯底亚协定审查会的管辖范围。凡未经授权擅入者，均视作非法入侵，弥萨格有权充分行使自卫权。」,"""Mythag is independent of the jurisdiction of both the Kingdom of Leonia and the Mystia Treaty Committee. Any unauthorized entry shall be regarded as unlawful intrusion, and Mythag reserves the full right to exercise self-defense."""
