AvgDialog_19063_Content_3,agNS,avg章4_AvgDialog_C_M.csv,832,AvgDialog,Content,,不多时，地狱犬发出一声混沌的呜咽，消散在空气中。,"Before long, the Hellhound let out a chaotic whimper and dissipated into the air."
AvgDialog_19063_Content_4,agNT,avg章4_AvgDialog_C_M.csv,833,AvgDialog,Content,,拉蒙娜回望了一眼仍在相拥而泣的母女，叹息着用指尖敲打了两下胸针。,"Ramona glanced back at the mother and daughter, still embracing and weeping, sighed, and tapped her brooch twice with her fingertip."
AvgDialog_19063_Content_5,agNU,avg章4_AvgDialog_C_M.csv,834,AvgDialog,Content,拉蒙娜,调查员拉蒙娜，申请记录，“地狱犬”已击败，任务完成。,"Investigator Ramona, application record: ""Hellhound"" defeated, mission accomplished."
AvgDialog_19063_Content_6,agNV,avg章4_AvgDialog_C_M.csv,835,AvgDialog,Content,玩家,守密人%player%，准备回收唤醒体莉莉、改造体库姆，申请收容相关嫌疑人弗朗西斯·奥斯伍德……,"Keeper %player%, preparing to retrieve Awakener Lily and the modified Koum, and apply for the containment of related suspect Francis Oswald..."
AvgDialog_19063_Content_7,agNW,avg章4_AvgDialog_C_M.csv,836,AvgDialog,Content,艾瑞卡,……录入……嗞啦……地狱……,...Input...Zzz...Hell...
AvgDialog_19063_Content_8,agNX,avg章4_AvgDialog_C_M.csv,837,AvgDialog,Content,,通讯另一端，艾瑞卡的声音模糊不清。,"On the other end of the call, Erica's voice was indistinct."
AvgDialog_19063_Content_9,agNY,avg章4_AvgDialog_C_M.csv,838,AvgDialog,Content,玩家,艾瑞卡，你在吗？能听清吗？,"Erica, are you there? Can you hear me clearly?"
AvgDialog_19063_Content_10,agND,avg章4_AvgDialog_C_M.csv,839,AvgDialog,Content,弗朗西斯疯狂版,……不！小心！,...No! Be careful!
AvgDialog_19063_Content_11,agNE,avg章4_AvgDialog_C_M.csv,840,AvgDialog,Content,,在弗朗西斯的尖叫声中，紫色的烟雾快速汇聚成型，以雷霆之势袭向你和拉蒙娜。,"Amid Francis's screams, the purple smoke rapidly converges and strikes you and Ramona with thunderous force."
AvgDialog_19063_Content_12,agNF,avg章4_AvgDialog_C_M.csv,841,AvgDialog,Content,,你推了一把拉蒙娜，挡在她的身前，人类的本能使你闭上了眼睛，准备迎接噩梦般的穿刺。,"You pushed Ramona behind you, instinctively closing your eyes, preparing for the nightmarish impalement."
AvgDialog_19063_Content_13,agNG,avg章4_AvgDialog_C_M.csv,842,AvgDialog,Content,库姆,呜！,Growl!
AvgDialog_19063_Content_14,agNH,avg章4_AvgDialog_C_M.csv,843,AvgDialog,Content,,预想中的疼痛并没有到来，挡在你面前的是被紫色尖刺完全贯穿的野兽。,"The expected pain never came. Instead, in front of you stood a beast completely impaled by purple spikes."
AvgDialog_19063_Content_15,agNI,avg章4_AvgDialog_C_M.csv,844,AvgDialog,Content,,锐利尖刺很快消失不见了，留在原地的并非惨烈的伤口，而是一个圆形的空洞。,"The sharp spikes quickly disappeared, leaving behind not a gruesome wound but a circular void."
AvgDialog_19063_Content_16,agNJ,avg章4_AvgDialog_C_M.csv,845,AvgDialog,Content,,那空洞仿佛抽走了支撑库姆的全部力量，巨大的身体缓缓瘫软在地，渐渐停止了呼吸。,"The void seemed to drain all of Koum's strength. Her massive body slowly collapsed to the ground, and her breathing gradually stopped."
AvgDialog_19063_Content_17,agNK,avg章4_AvgDialog_C_M.csv,846,AvgDialog,Content,,一切发生得太过突然，你根本来不及做出反应。,Everything happened so suddenly that you had no time to react.
AvgDialog_19063_Content_18,agNL,avg章4_AvgDialog_C_M.csv,847,AvgDialog,Content,,紫色烟雾再次自罅隙中涌出，比方才庞大数倍的身躯将墙面上断裂的密文撕扯出触目惊心的创口。,"Purple smoke surged out of the cracks once more, and a body several times larger than before tore apart the broken runes on the wall, leaving a horrifying gash."
AvgDialog_19063_Content_19,agNM,avg章4_AvgDialog_C_M.csv,848,AvgDialog,Content,,“地狱犬”现出了它的真形，先前出现的不过是刻耳柏洛斯的冰山一角，此刻的祂正以巨兽之姿俯视着擅自宣告胜利的你们。,"The ""Hellhound"" has revealed its true form. What appeared before was merely the tip of the Cerberus iceberg. Now, it gazes down at you, who has presumptuously declared victory, in its colossal beast form."
AvgDialog_19063_Content_20,agNO,avg章4_AvgDialog_C_M.csv,849,AvgDialog,Content,,在房间的一角，恢复平静的白色少女缓缓起身，倒退两步，离开了哭倒的母亲的怀抱。,"In a corner of the room, the white-haired girl, now calm, slowly stood up, took two steps back, and left her weeping mother's embrace."
AvgDialog_19063_Content_21,agNP,avg章4_AvgDialog_C_M.csv,850,AvgDialog,Content,莉莉,妈妈，你能认出我，真是太好了。,"Mom, I'm so happy that you were able to recognize me."
AvgDialog_19063_Content_22,agNQ,avg章4_AvgDialog_C_M.csv,851,AvgDialog,Content,莉莉,"是%player%%brotherorsister1%、拉蒙娜姐姐让我下定了决心……
我很感激%heorshe%们。","It was {Male=big brother,Female=big sister} %player% and big sister Ramona who helped me make up my mind...\nI am very grateful to them."
AvgDialog_19063_Content_23,agNR,avg章4_AvgDialog_C_M.csv,852,AvgDialog,Content,莉莉,所以，我想帮%heorshe%们。,"So, I want to help them."
AvgDialog_19052_Content_1,agJN,avg章4_AvgDialog_C_M.csv,853,AvgDialog,Content,,日落,Sunset
AvgDialog_19052_Content_2,agJY,avg章4_AvgDialog_C_M.csv,854,AvgDialog,Content,,莉莉娇嫩的赤足踏前，黑色的脓液在她的脚边汇聚成型。,"Lily's tender bare feet step forward, with black pus gathering and taking shape at her feet."
AvgDialog_19052_Content_3,agKj,avg章4_AvgDialog_C_M.csv,855,AvgDialog,Content,莉莉,丽莎说，她妈妈不认识她了，还用猎枪打伤了她。,Lisa said that her mom didn't recognize her and wounded her with a hunting rifle.
AvgDialog_19052_Content_4,agKl,avg章4_AvgDialog_C_M.csv,856,AvgDialog,Content,莉莉,丽莎说，她妈妈很严厉，每次她和我玩，她妈妈都会打她、骂她。,"Lisa said that her mom is very strict. Every time she plays with me, her mom hits and scolds her."
AvgDialog_19052_Content_5,agKm,avg章4_AvgDialog_C_M.csv,857,AvgDialog,Content,莉莉,丽莎说，如果让她妈妈知道，她是因为和我出门才变成了大狗狗，那她的妈妈一定不会原谅她。,"Lisa said that if her mom finds out she turned into a large beast because she went out with me, her mom definitely won't forgive her."
AvgDialog_19052_Content_6,agKn,avg章4_AvgDialog_C_M.csv,858,AvgDialog,Content,莉莉,但她还是忍不住，她太饿了，因为不想偷其他人的东西，所以她才忍不住回家找东西吃……才会被妈妈发现……,"But she couldn't help it; she was too hungry. Not wanting to steal from others, she went home to find food... and that's when her mother found out..."
AvgDialog_19052_Content_7,agKo,avg章4_AvgDialog_C_M.csv,859,AvgDialog,Content,,莉莉停顿了片刻。,Lily paused for a moment.
AvgDialog_19052_Content_8,agKp,avg章4_AvgDialog_C_M.csv,860,AvgDialog,Content,莉莉,但是，我的妈妈不一样。,But my mom is different.
AvgDialog_19052_Content_9,agKq,avg章4_AvgDialog_C_M.csv,861,AvgDialog,Content,莉莉,她以为我是其他人，但她在第一次用手术刀划开我的时候，对我说对不起了。,"She mistook me for someone else, but when she first cut me with the scalpel, she apologized."
AvgDialog_19052_Content_10,agJO,avg章4_AvgDialog_C_M.csv,862,AvgDialog,Content,莉莉,那个时候，我一点都不觉得痛，真的一点都不痛。,"At that time, I didn't feel any pain at all. Truly, not a single bit."
AvgDialog_19052_Content_11,agJP,avg章4_AvgDialog_C_M.csv,863,AvgDialog,Content,莉莉,后来，事情变得有点不一样了。妈妈把我关起来，做了更多、更多的实验。,"Later, things changed. Mom locked me up and conducted more and more experiments."
AvgDialog_19052_Content_12,agJQ,avg章4_AvgDialog_C_M.csv,864,AvgDialog,Content,莉莉,"但这不是妈妈的错。
因为，妈妈也和我关在一起，关在不能离开的，这个房间。",But it's not Mom's fault.\nBecause Mom is locked up with me in this room that we can't leave.
AvgDialog_19052_Content_13,agJR,avg章4_AvgDialog_C_M.csv,865,AvgDialog,Content,莉莉,"因为我，不受控制，害死了很多人。
因为我……太痛了。","Because of me, I lost control and many people died.\nBecause of me... it hurts too much."
AvgDialog_19052_Content_14,agJS,avg章4_AvgDialog_C_M.csv,866,AvgDialog,Content,莉莉,丽莎说，因为她是我唯一的朋友，所以她会努力，陪我久一点。,"Lisa said that since she's my only friend, she'll try to stay with me a little longer."
AvgDialog_19052_Content_15,agJT,avg章4_AvgDialog_C_M.csv,867,AvgDialog,Content,莉莉,不然，她早就撑不下去了。,"Otherwise, she wouldn't have lasted this long."
AvgDialog_19052_Content_16,agJU,avg章4_AvgDialog_C_M.csv,868,AvgDialog,Content,莉莉,……其实我也，早就撑不下去了。,"...Actually, I can't hold on any longer either."
AvgDialog_19052_Content_17,agJV,avg章4_AvgDialog_C_M.csv,869,AvgDialog,Content,,巨型野兽撕裂了更多空间，利爪直直挥向莉莉。,"The giant beast tore through more space, its claws slashing directly at Lily."
AvgDialog_19052_Content_19,agJX,avg章4_AvgDialog_C_M.csv,871,AvgDialog,Content,,在那摇摇欲坠的纯白少女身前，黑色的黏液凝聚成球、成网，一次一次化解了祂的攻势。,"In front of the faltering pure white maiden, black slime coalesced into spheres and webs, repeatedly neutralizing its attacks."
AvgDialog_19052_Content_20,agJZ,avg章4_AvgDialog_C_M.csv,872,AvgDialog,Content,莉莉,但是，即使是这样——,"However, even so —"
AvgDialog_19052_Content_21,agKa,avg章4_AvgDialog_C_M.csv,873,AvgDialog,Content,莉莉,那也是我唯一的妈妈。,That is my one and only mother.
AvgDialog_19052_Content_23,agKc,avg章4_AvgDialog_C_M.csv,875,AvgDialog,Content,莉莉,不准——伤害我的妈妈！,I won't let you — harm my mother!
AvgDialog_19052_Content_24,agKd,avg章4_AvgDialog_C_M.csv,876,AvgDialog,Content,,黑色黏球爆裂，汇聚成刺，钉住地狱犬的利爪。,"The black goo burst, forming spikes that pinned down the hellhound's claws."
AvgDialog_19052_Content_25,agKe,avg章4_AvgDialog_C_M.csv,877,AvgDialog,Content,,残余的黏球张开尖刀般的利齿，咬断被束缚的脚踝。,The remaining sticky ball opens its razor-sharp teeth and bites through the bound ankle.
AvgDialog_19052_Content_27,agKg,avg章4_AvgDialog_C_M.csv,879,AvgDialog,Content,,祂彻底割裂了空间，凝固的时间从裂隙一丝丝逃逸，夕阳光线被完全吞噬。,"It completely shattered space, with time slowly escaping from the fissure. The rays of the setting sun were entirely devoured."
AvgDialog_19052_Content_28,agKh,avg章4_AvgDialog_C_M.csv,880,AvgDialog,Content,,"利爪消散成妖紫的烟雾，然后再度汇聚成型。
而那扭曲的异质肢体，自空间狭缝中冲出，向莉莉扑袭而去！","The claws dissipated into a demonic purple mist, then reformed.\nThose twisted limbs burst forth from the spatial rift, lunging at Lily!"
AvgDialog_19052_Content_30,agKk,avg章4_AvgDialog_C_M.csv,882,AvgDialog,Content,,你与拉蒙娜对视一眼，加入了战局。,You exchange a glance with Ramona and join the battle.
AvgDialog_19044_Content_1,agIc,avg章4_AvgDialog_C_M.csv,883,AvgDialog,Content,,一番激战之后，一边攻击一边保护弗朗西斯的莉莉早已左支右绌，疲态毕露。,"After a fierce battle, Lily, who was struggling to attack and protect Francis at the same time, was already stretched to her limit and showing obvious signs of fatigue."
AvgDialog_19044_Content_2,agIn,avg章4_AvgDialog_C_M.csv,884,AvgDialog,Content,,她的黑色脓胞被贯穿了几次，好在反应及时没有伤及根本，若是再缠斗一会儿，恐怕就要完全脱力。,"Her black pustules were pierced several times, but she reacted quickly and avoided serious injury. If the fight drags on any longer, she will be completely drained of energy."
AvgDialog_19044_Content_3,agIw,avg章4_AvgDialog_C_M.csv,885,AvgDialog,Content,萝坦,别楞着了，难道我们要让那个小家伙自己对抗怪物吗！,Don't just stand there! Are we really going to let that little girl fight the monsters alone?!
AvgDialog_19044_Content_4,agIx,avg章4_AvgDialog_C_M.csv,886,AvgDialog,Content,弗朗西斯,没用的……没用的！,It's useless... It's useless!
AvgDialog_19044_Content_5,agIy,avg章4_AvgDialog_C_M.csv,887,AvgDialog,Content,弗朗西斯,那只野兽，是<Yellow:因果律的怪物>。,That beast is a <Yellow:monster of causality>.
AvgDialog_19044_Content_6,agIz,avg章4_AvgDialog_C_M.csv,888,AvgDialog,Content,萝坦,因果律的怪物？,A monster of causality?
AvgDialog_19044_Content_7,agIA,avg章4_AvgDialog_C_M.csv,889,AvgDialog,Content,拉蒙娜,意思是，这只怪物因为事物的因果存在，只要有因，就有果。,"This means that this monster exists because of the cause-and-effect relationship of things; as long as there is a cause, there will be an effect."
AvgDialog_19044_Content_8,agIB,avg章4_AvgDialog_C_M.csv,890,AvgDialog,Content,拉蒙娜,"<Yellow:只要有人开始了维度穿越，祂就会开始追猎这名僭越者。>
无论过程如何变改，祂不死不灭，直至完成追猎。","<Yellow:Once someone begins dimensional travel, it will start hunting the transgressor.>\nNo matter how the process changes, it remains immortal until the hunt is complete."
AvgDialog_19044_Content_9,agIC,avg章4_AvgDialog_C_M.csv,891,AvgDialog,Content,拉蒙娜,而这个手术室经过改造，时间被独立在了维度之外。,"This operating room has been modified, and time exists independently outside its dimension."
AvgDialog_19044_Content_10,agId,avg章4_AvgDialog_C_M.csv,892,AvgDialog,Content,玩家,“为其所猎三次者，魂灵定归冥府”……,"""For those hunted three times, the soul shall surely return to the underworld""..."
AvgDialog_19044_Content_11,agIe,avg章4_AvgDialog_C_M.csv,893,AvgDialog,Content,拉蒙娜,没错，在场所有人，都被祂视作了维度穿越者……被视作了维度之犬的猎物。,"Indeed, everyone here is seen by It as dimensional travelers... regarded as the prey of the Hellhound."
AvgDialog_19044_Content_12,agIf,avg章4_AvgDialog_C_M.csv,894,AvgDialog,Content,萝坦,喂，臭女人，你一定知道怎么对付这家伙吧？,"Hey, you wretched woman, you must know how to deal with this guy, right?"
AvgDialog_19044_Content_13,agIg,avg章4_AvgDialog_C_M.csv,895,AvgDialog,Content,弗朗西斯,……没错。方法说来也简单。,...That's right. The method is quite simple.
AvgDialog_19044_Content_14,agIh,avg章4_AvgDialog_C_M.csv,896,AvgDialog,Content,弗朗西斯,这只怪物的追猎，是<Yellow:有序地跨越所有维度>的。,This monster's hunt <Yellow:is systematically carried out across all dimensions>.
AvgDialog_19044_Content_15,agIi,avg章4_AvgDialog_C_M.csv,897,AvgDialog,Content,弗朗西斯,"所以，所有维度中<Yellow:只存在唯一一只“地狱犬”>。
只要将祂囚禁在牢笼当中，祂就无法再伤害任何人。","Therefore, <Yellow:there is only one ""Hellhound"" across all dimensions>.\nAs long as it is caged, it cannot harm anyone."
AvgDialog_19044_Content_16,agIj,avg章4_AvgDialog_C_M.csv,898,AvgDialog,Content,萝坦,说得轻巧！你要怎么关起来一只能穿越维度的狗啊！,Easier said than done! How are you going to lock up a dog that can traverse dimensions?!
AvgDialog_19044_Content_17,agIk,avg章4_AvgDialog_C_M.csv,899,AvgDialog,Content,拉蒙娜,……墙上的密文。祂是在密文被破坏后才出现的。,...the cryptic text on the wall. It only appeared after the cryptic text was damaged.
AvgDialog_19044_Content_18,agIl,avg章4_AvgDialog_C_M.csv,900,AvgDialog,Content,弗朗西斯,你的观察力很敏锐，小姑娘。这段密文，是刚才那位达芙黛尔夫人卖给我的，代价是我死后将头颅交给她。,"Your observation is sharp, young lady. This ciphertext was sold to me by Lady Daffodil, at the cost of my head after I die."
AvgDialog_19044_Content_19,agIm,avg章4_AvgDialog_C_M.csv,901,AvgDialog,Content,萝坦,那你还能修好它吗？,Can it be fixed?
AvgDialog_19044_Content_20,agIo,avg章4_AvgDialog_C_M.csv,902,AvgDialog,Content,,弗朗西斯怔住了，似乎从来没有思考过这个问题。,"Francis was stunned, as if she had never considered this question before."
AvgDialog_19044_Content_21,agIp,avg章4_AvgDialog_C_M.csv,903,AvgDialog,Content,萝坦,快说啊，到底行不行？,"Come on, can you do it or not?"
AvgDialog_19044_Content_22,agIq,avg章4_AvgDialog_C_M.csv,904,AvgDialog,Content,弗朗西斯,"它的图形牢牢地刻在我的脑子里。
只是，我需要非常细致地描绘它，不能有一点偏差。","The images are firmly etched in my mind.\nHowever, I need to depict it with great precision, without the slightest deviation."
AvgDialog_19044_Content_23,agIr,avg章4_AvgDialog_C_M.csv,905,AvgDialog,Content,弗朗西斯,我需要更多时间。,I need more time.
AvgDialog_19044_Content_24,agIs,avg章4_AvgDialog_C_M.csv,906,AvgDialog,Content,玩家,只是时间的话，就交给我们吧。,Just leave the matter of time to us.
AvgDialog_19044_Content_25,agIt,avg章4_AvgDialog_C_M.csv,907,AvgDialog,Content,玩家,萝坦，上了！,"Lotan, let's go!"
AvgDialog_19044_Content_26,agIu,avg章4_AvgDialog_C_M.csv,908,AvgDialog,Content,萝坦,哈，久等多时了！,"Ha, I've been waiting for you for a long time!"
AvgDialog_19044_Content_27,agIv,avg章4_AvgDialog_C_M.csv,909,AvgDialog,Content,拉蒙娜,别蛮干，注意消耗！,"Don't act recklessly, watch your stamina!"
AvgDialog_19035_Content_1,agDP,avg章4_AvgDialog_C_M.csv,910,AvgDialog,Content,莉莉,%player%%brotherorsister1%，再坚持一下！,"{Male=Mr.,Female=Miss} %player%, hang in there!"
AvgDialog_19035_Content_2,agDQ,avg章4_AvgDialog_C_M.csv,911,AvgDialog,Content,莉莉,这个脓疱，能变形保护你！,This pustule can transform to protect you!
AvgDialog_19035_Content_3,agDR,avg章4_AvgDialog_C_M.csv,912,AvgDialog,Content,莉莉,"现在，就展开它来阻挡穿刺吧。
没关系的，莉莉不会痛的！","Unfold it now to block the piercing. \n It's all right, Lily won't feel any pain!"
AvgDialog_19068_Content_1,agQY,avg章4_AvgDialog_C_M.csv,913,AvgDialog,Content,,莉莉仍在御使着黑色脓疱与地狱犬周旋，动作却已不如刚才灵敏。,"Lily is still controlling the black pustules and fighting the hellhound, but her movements are no longer as agile as before."
AvgDialog_19068_Content_2,agRj,avg章4_AvgDialog_C_M.csv,914,AvgDialog,Content,,五分钟。,Five minutes.
AvgDialog_19068_Content_3,agRu,avg章4_AvgDialog_C_M.csv,915,AvgDialog,Content,,十分钟。,Ten minutes.
AvgDialog_19068_Content_4,agRF,avg章4_AvgDialog_C_M.csv,916,AvgDialog,Content,,十五分钟。,Fifteen minutes.
AvgDialog_19068_Content_6,agRX,avg章4_AvgDialog_C_M.csv,918,AvgDialog,Content,萝坦,喂，好了没有啊！,"Hey, are you done yet!"
AvgDialog_19068_Content_7,agRY,avg章4_AvgDialog_C_M.csv,919,AvgDialog,Content,弗朗西斯,嗯，完成了。,"Hmm, finished."
AvgDialog_19068_Content_8,agRZ,avg章4_AvgDialog_C_M.csv,920,AvgDialog,Content,,落笔与起笔如衔尾蛇般首尾相接，弗朗西斯面前的图案忽然汇聚成了一个令你有些头晕的密文。,"The strokes and lines intertwined like an ouroboros, forming a dizzying cipher in front of Francis."
AvgDialog_19068_Content_9,agSa,avg章4_AvgDialog_C_M.csv,921,AvgDialog,Content,拉蒙娜,别盯着看！,Don't look!
AvgDialog_19068_Content_10,agQZ,avg章4_AvgDialog_C_M.csv,922,AvgDialog,Content,,拉蒙娜遮住了你的视线，从你的口袋中掏出一支试管，拧开给你灌了下去。,"Ramona covered your eyes, took a vial from your pocket, unscrewed it, and poured it down your throat."
AvgDialog_19068_Content_11,agRa,avg章4_AvgDialog_C_M.csv,923,AvgDialog,Content,弗朗西斯,打开那边的门，走出去，你们就永远不会受祂困扰了。,"Open that door, walk out, and you will never be troubled by It again."
AvgDialog_19068_Content_12,agRb,avg章4_AvgDialog_C_M.csv,924,AvgDialog,Content,弗朗西斯,把莉莉……也带走吧。,Take Lily... with you.
AvgDialog_19068_Content_13,agRc,avg章4_AvgDialog_C_M.csv,925,AvgDialog,Content,玩家,你不和我们一起吗？,Aren't you coming with us?
AvgDialog_19068_Content_14,agRd,avg章4_AvgDialog_C_M.csv,926,AvgDialog,Content,弗朗西斯,"只有狩猎猎物的时候，地狱犬才会出现。
如果这个房间里一个人都没有，祂怎么会停在这里？","Only when hunting prey does the Hellhound appear.\nIf there is no one in this room, why would it stop here?"
AvgDialog_19068_Content_15,agRe,avg章4_AvgDialog_C_M.csv,927,AvgDialog,Content,弗朗西斯,你们都是好孩子，而我应当为我犯下的罪行赎罪。,"You are all good children, and I must atone for the crimes I have committed."
AvgDialog_19068_Content_16,agRf,avg章4_AvgDialog_C_M.csv,928,AvgDialog,Content,弗朗西斯,请你们……照顾好莉莉。,Please... take good care of Lily.
AvgDialog_19068_Content_17,agRg,avg章4_AvgDialog_C_M.csv,929,AvgDialog,Content,莉莉,妈妈！莉莉不走！,Mom! Lily won't leave!
AvgDialog_19068_Content_18,agRh,avg章4_AvgDialog_C_M.csv,930,AvgDialog,Content,弗朗西斯,莉莉听话。,"Lily, be obedient."
AvgDialog_19068_Content_19,agRi,avg章4_AvgDialog_C_M.csv,931,AvgDialog,Content,莉莉,"莉莉不会听话了，妈妈之前说，好孩子不可以喊疼……莉莉听了。
所以，这一次，莉莉不会听话了！","Lily won't obey anymore. Mother used to say, ""Good children shouldn't cry when hurt..."" Lily listened.\nSo this time, Lily won't obey anymore!"
AvgDialog_19068_Content_20,agRk,avg章4_AvgDialog_C_M.csv,932,AvgDialog,Content,,她竭力抬起手臂，指挥脓疱冲向紫色的烟雾，而地狱犬只用一瞬间就将其刺破，落下一地浓稠的液体。,"She strained to lift her arm, directing the pustules toward the purple smoke. However, the Hellhound pierced them in an instant, spilling thick liquid all over the ground."
AvgDialog_19068_Content_21,agRl,avg章4_AvgDialog_C_M.csv,933,AvgDialog,Content,,弗朗西斯望向你们，目光与言辞一样恳切。,"Francis looks at you all, her gaze as sincere as her words."
AvgDialog_19068_Content_22,agRm,avg章4_AvgDialog_C_M.csv,934,AvgDialog,Content,弗朗西斯,带她走吧。,Take her away.
AvgDialog_19068_Content_23,agRn,avg章4_AvgDialog_C_M.csv,935,AvgDialog,Content,弗朗西斯,<Italic:这是我这个罪人、这个失职的母亲，最后的请求。>,"<Italic:This is the final plea of a sinner, a neglectful mother.>"
AvgDialog_19068_Content_24,agRo,avg章4_AvgDialog_C_M.csv,936,AvgDialog,Content,,你们默契地选择了依言执行。,You unanimously chose to follow her instructions
AvgDialog_19068_Content_25,agRp,avg章4_AvgDialog_C_M.csv,937,AvgDialog,Content,,就像她曾经对拉蒙娜做过的一样，你和拉蒙娜将莉莉推上了萝坦的肩头。,"Just like she once did to Ramona, you and Ramona lifted Lily onto Lotan's shoulders."
AvgDialog_19068_Content_26,agRq,avg章4_AvgDialog_C_M.csv,938,AvgDialog,Content,萝坦,咳，这种时候，力气活还得我来啊。,"Well, I guess it's up to me to handle the heavy lifting at a time like this."
AvgDialog_19068_Content_27,agRr,avg章4_AvgDialog_C_M.csv,939,AvgDialog,Content,莉莉,妈妈！——,Mom!—
AvgDialog_19068_Content_28,agRs,avg章4_AvgDialog_C_M.csv,940,AvgDialog,Content,,"失去反抗能力的莉莉，就这么被你们带离了这片扭曲的空间。
带离了弗朗西斯——她的母亲的葬身之所。","Thus Lily, who had lost the ability to resist, was taken away by you from this twisted dimension.\nTaken away from Francis—from the final burial ground where her mother rests."
AvgDialog_19068_Content_29,agRt,avg章4_AvgDialog_C_M.csv,941,AvgDialog,Content,,离开时，你刻意看了一眼闪烁着诡谲星光的窗外。,"As you left, you deliberately glanced at the window shimmering with eerie starlight."
AvgDialog_19068_Content_30,agRv,avg章4_AvgDialog_C_M.csv,942,AvgDialog,Content,,那里一片混沌，除了深沉的光以外，似乎什么都没有。,"It was filled with chaos, with nothing there except deep light."
AvgDialog_19068_Content_31,agRw,avg章4_AvgDialog_C_M.csv,943,AvgDialog,Content,,……,…
AvgDialog_19068_Content_32,agRx,avg章4_AvgDialog_C_M.csv,944,AvgDialog,Content,,……,...
AvgDialog_19068_Content_33,agRy,avg章4_AvgDialog_C_M.csv,945,AvgDialog,Content,,弗朗西斯满身脏污，向着庞大的怪物缓步前进。,"Francis, covered in dirt, slowly approaches the massive monster."
AvgDialog_19068_Content_34,agRz,avg章4_AvgDialog_C_M.csv,946,AvgDialog,Content,弗朗西斯,达芙黛尔曾经提醒过我，凡人对时间进行的极微小的改变，都会招来名为“@4之猎犬”的怪物。,"Daffodil once warned me that even the slightest temporal changes made by mortals will invite a monster known as ""@4's Hunting Dog""."
AvgDialog_19068_Content_35,agRA,avg章4_AvgDialog_C_M.csv,947,AvgDialog,Content,弗朗西斯,那时我一心想要改变过去，想要贪哪怕一分一秒的时间，逆转被融蚀改变的一切。,"Back then, I was determined to change the past, to grasp even a single second, and reverse everything that had been altered by the Dissolution."
